word,category,sentences
"美麗","Adjective","這片風景非常美麗，吸引了無數遊客前來拍照留念。|她穿著一件美麗的禮服出現在舞會上，每個人都讚不絕口。"
"寒冷","Adjective","冬天的北方非常寒冷，氣溫經常降到零下二十度。|如果不穿厚外套，在這麼寒冷的天氣裡很容易感冒。"
"昂貴","Adjective","這隻名牌手錶價格極其昂貴，普通人根本負擔不起。|這家餐廳的菜餚雖然美味，但價格實在太昂貴了。"
"誠實","Adjective","他是一個誠實的人，從來不說謊或欺騙朋友。|唯有誠實的面對錯誤，才能贏得別人的原諒與信任。"
"狹窄","Adjective","這條小巷子非常狹窄，連一輛小轎車都難以通過。|老舊公寓的走廊十分狹窄，兩個人並肩走都很困難。"
"勤奮","Adjective","他工作非常勤奮，每天都是公司裡最早到最晚走的人。|只要你足夠勤奮，在學業上一定能取得優異的成績。"
"巨大","Adjective","這座雕像規模巨大，遠在幾公里外就能清晰看見。|科學家在深海中發現了一隻體型巨大的未知生物。"
"安靜","Adjective","圖書館裡非常安靜，只聽得到翻書與寫字的聲音。|深夜的小鎮顯得格外安靜，沒有任何車輛經過的嘈雜聲。"
"勇敢","Adjective","那位勇敢的消防員衝進火場，救出了受困的小孩。|面對困難時，我們需要有勇敢的心去挑戰並克服它。"
"憤怒","Adjective","看到辛辛苦苦完成的作品被破壞，他感到非常憤怒。|他因為受到不公平的對待而露出了憤怒的表情。"
"潮濕","Adjective","梅雨季節的空氣非常潮濕，衣服晾了好幾天都不會乾。|這間地下室既陰暗又潮濕，牆角甚至都長出了黴菌。"
"聰明","Adjective","這個孩子非常聰明，簡單的數學題看一眼就知道答案。|她利用聰明的才智，成功解決了公司面臨的重大危機。"
"枯燥","Adjective","這場演講的內容十分枯燥，台下的聽眾都快睡著了。|每天重複同樣的工作讓他覺得生活變得非常枯燥乏味。"
"溫柔","Adjective","護士小姐說話的聲音非常溫柔，讓病人的心情放鬆不少。|她對待流浪貓總是特別溫柔，會輕聲細語地跟牠們說話。"
"茂密","Adjective","這片原始森林裡有著茂密的植被，陽光幾乎照不進來。|夏天的這棵大樹長得非常茂密，提供了一個涼爽的遮蔭處。"
"慷慨","Adjective","這位企業家非常慷慨，每年都會捐出大筆資金幫助窮人。|他對待朋友一向很慷慨，總是主動請客且從不計較金錢。"
"敏捷","Adjective","貓的身手非常敏捷，能輕易地跳上高牆並捕捉獵物。|足球守門員必須擁有敏捷的反應，才能擋住飛速而來的球。"
"混亂","Adjective","車禍發生後，現場交通陷入一片混難，警察正忙著指揮。|這間臥室非常混亂，地上到處都是隨意丟棄的衣服和書本。"
"謙虛","Adjective","儘管他獲得了最高榮譽，但他依然保持謙虛，從不炫耀。|一個謙虛的人往往能虛心接受他人的建議，進而不斷進步。"
"脆弱","Adjective","這件古董瓷器非常脆弱，搬運時必須格外小心。|她在剛失戀時心靈非常脆弱，需要朋友長時間的陪伴。"
"學習","Verb","他每天花三小時學習韓語，希望能流利對話。|終身學習是保持頭腦靈活的最佳方法。"
"跑步","Verb","為了參加馬拉松，他每天清晨都會去公園跑步。|他在操場上跑步，汗水浸透了整件運動衫。"
"烹飪","Verb","她非常喜歡烹飪，總能用簡單的食材做出五星級的料理。|他在廚房烹飪晚餐時，屋子裡充滿了迷人的香味。"
"閱讀","Verb","在安靜的圖書館裡，他正專心地閱讀一本歷史小說。|多閱讀可以增廣見聞，並豐富我們的詞彙量。"
"游泳","Verb","夏天天氣炎熱，許多小朋友喜歡到海邊游泳消暑。|他像魚兒一樣在水裡自在地游泳，泳速非常快。"
"駕駛","Verb","在取得執照之前，你必須先學會如何安全地駕駛汽車。|他在高速公路上小心地駕駛，時刻注意後方來車。"
"修理","Verb","水龍頭漏水了，爸爸正拿著工具箱準備修理。|這台電腦壞了很久，技師終於把它修理好了。"
"慶祝","Verb","全家人聚在一起，共同慶祝奶奶的八十歲大壽。|贏得比賽後，球員們開香檳大聲歡呼來慶祝勝利。"
"溝通","Verb","兩國領導人決定透過對話來溝通，以解決長久以來的糾紛。|良好的溝通是建立穩定人際關係的基石。"
"拒絕","Verb","雖然對方的條件很誘人，但他還是堅定地拒絕了這項提議。|他因為太忙而不得不拒絕了朋友的聚會邀請。"
"考慮","Verb","這是一項重大的決定，請給我幾天的時間仔細考慮。|在買房之前，你必須考慮到交通、機能與預算問題。"
"保護","Verb","為了保護環境，我們應該減少使用一次性塑膠產品。|這層特殊的塗料可以保護木頭不受潮濕天氣的侵蝕。"
"解釋","Verb","老師正在黑板上畫圖，試圖向學生解釋地心引力的原理。|你能解釋一下為什麼你今天開會遲到了嗎？"
"觀察","Verb","科學家在野外長時間觀察鳥類的遷徙習慣。|透過顯微鏡觀察，我們可以看到細胞的微觀結構。"
"打掃","Verb","過年前，全家人會一起大掃除，把家裡打掃得一塵不染。|下課後，學生們輪流留在教室打掃衛生。"
"創造","Verb","這位藝術家用廢棄的金屬創造出一件令人驚嘆的雕塑作品。|科技的進步為人類創造了更便利的生活方式。"
"等待","Verb","他在火車站的長椅上焦急地等待，期待見到多年不見的好友。|好機會值得耐心等待，不要因為一時衝動而放棄。"
"討論","Verb","我們針對明年的行銷計畫進行了深入的討論。|同學們圍坐在一起討論老師剛才提出的問題。"
"練習","Verb","想要彈好鋼琴，唯一的捷徑就是不斷地練習。|他在家裡對著鏡子練習演講，調整自己的表情與語氣。"
"忘記","Verb","他出門太匆忙，竟然忘記帶錢包和鑰匙。|時間會讓人忘記痛苦，但珍貴的回憶永遠都在。"
"在","Adposition","他現在正坐在椅子上看書，一動也不動。|那本書就在桌子上面，你自己去拿。"
"從","Adposition","我們打算從臺北搭火車去花蓮旅遊。|這段引文是從那本著名的古典小說中節錄出來的。"
"到","Adposition","這班公車會直接開到市中心，中途不停靠。|他每天從早忙到晚，幾乎沒有休息的時間。"
"對","Adposition","多吃蔬菜對身體健康非常有幫助。|他對這件突發事件的反應感到非常驚訝。"
"向","Adposition","請你向左轉，走到底就會看到那家書店了。|他誠懇地向老師請教關於未來職涯發展的問題。"
"往","Adposition","沿著這條路一直往北走，你就會看到火車站。|這班飛機是往美國舊金山的，請旅客準時登機。"
"離","Adposition","我家離學校很近，走路只要五分鐘就到了。|他現在所在的位置離終點線只剩下一百公尺。"
"自","Adposition","這份禮物是自遠方寄來的，充滿了朋友的心意。|他自幼就對天文學感興趣，夢想成為宇航員。"
"朝","Adposition","他朝著太陽升起的方向跑去，迎接新的一天。|請朝這張紙的中心點看，你會發現隱藏的圖案。"
"跟","Adposition","我明天想跟朋友一起去電影院看最新上映的大片。|他跟弟弟長得非常像，外人很難分辨出來。"
"與","Adposition","這項政策與民眾的生活息息相關，必須謹慎處理。|他與家人在公園散步，享受溫暖的午後陽光。"
"由","Adposition","這場音樂會將由著名的指揮家帶領樂團演出。|這個提案是由委員會經過多方討論後決定的。"
"關於","Adposition","這本雜誌裡有許多關於環境保護的專題報導。|關於這項計畫的預算，我們還需要再進一步核算。"
"至於","Adposition","主菜我已經準備好了，至於甜點就交給你負責。|他很喜歡這支手機的設計，至於價格則在考慮範圍內。"
"除了","Adposition","除了蘋果以外，他什麼水果都不喜歡吃。|今天除了小明請假，其他同學都準時出席了。"
"為了","Adposition","為了能考上理想的大學，他每天都讀書到深夜。|他努力工作是為了給家人提供更好的生活環境。"
"依據","Adposition","法官會依據法律事實來做出最終的判決。|我們依據實驗結果得出結論，證明這個假設是正確的。"
"經過","Adposition","經過長時間的努力，他終於實現了創業的夢想。|經過那家店門口時，我被櫥窗裡的精美手錶吸引了。"
"沿著","Adposition","沿著這條河邊的小徑散步，風景非常優美。|你只要沿著黃色實線走，就能找到展覽廳的出口。"
"隨著","Adposition","隨著氣溫升高，冰淇淋的銷量也跟著大幅增加。|隨著年齡的增長，他變得越來越成熟穩重了。"